{
 "schema_version": 1,
 "source": "Le Morte d'Arthur, Vol. II (Project Gutenberg #1252) — the editors' glossary",
 "rights": "Public domain.",
 "note": "The glossary printed at the end of the Caxton text, lifted verbatim. `kind` separates words that have left the language ('archaic') from words that survive with a changed sense ('false-friend') — the second group is the one a modern reader misreads without noticing.",
 "corrections": [
  {
   "from": "Licours lecherous,",
   "to": "Licours, lecherous,"
  },
  {
   "from": "Mount~ lance, amount of, extent,",
   "to": "Mountenance, amount of, extent,"
  }
 ],
 "counts": {
  "total": 652,
  "archaic": 557,
  "false-friend": 95
 },
 "entries": [
  {
   "term": "Abashed",
   "match": "abashed",
   "gloss": "abased, lowered",
   "kind": "archaic"
  },
  {
   "term": "Abate",
   "match": "abate",
   "gloss": "depress, calm",
   "kind": "false-friend"
  },
  {
   "term": "Abought",
   "match": "abought",
   "gloss": "paid for",
   "kind": "archaic"
  },
  {
   "term": "Abraid",
   "match": "abraid",
   "gloss": "started",
   "kind": "archaic"
  },
  {
   "term": "Accompted",
   "match": "accompted",
   "gloss": "counted",
   "kind": "archaic"
  },
  {
   "term": "Accorded",
   "match": "accorded",
   "gloss": "agreed",
   "kind": "archaic"
  },
  {
   "term": "Accordment",
   "match": "accordment",
   "gloss": "agreement",
   "kind": "archaic"
  },
  {
   "term": "Acquit",
   "match": "acquit",
   "gloss": "repay",
   "kind": "false-friend"
  },
  {
   "term": "Adoubted",
   "match": "adoubted",
   "gloss": "afraid",
   "kind": "archaic"
  },
  {
   "term": "Advision",
   "match": "advision",
   "gloss": "vision",
   "kind": "archaic"
  },
  {
   "term": "Afeard",
   "match": "afeard",
   "gloss": "afraid",
   "kind": "archaic"
  },
  {
   "term": "Afterdeal",
   "match": "afterdeal",
   "gloss": "disadvantage",
   "kind": "archaic"
  },
  {
   "term": "Againsay",
   "match": "againsay",
   "gloss": "retract",
   "kind": "archaic"
  },
  {
   "term": "Aknown",
   "match": "aknown",
   "gloss": "known",
   "kind": "archaic"
  },
  {
   "term": "Aligement",
   "match": "aligement",
   "gloss": "alleviation",
   "kind": "archaic"
  },
  {
   "term": "Allegeance",
   "match": "allegeance",
   "gloss": "alleviation",
   "kind": "archaic"
  },
  {
   "term": "Almeries",
   "match": "almeries",
   "gloss": "chests",
   "kind": "archaic"
  },
  {
   "term": "Alther",
   "match": "alther",
   "gloss": "gen. pl., of all",
   "kind": "archaic"
  },
  {
   "term": "Anealed",
   "match": "anealed",
   "gloss": "anointed",
   "kind": "archaic"
  },
  {
   "term": "Anguishly",
   "match": "anguishly",
   "gloss": "in pain",
   "kind": "archaic"
  },
  {
   "term": "Anon",
   "match": "anon",
   "gloss": "at once",
   "kind": "archaic"
  },
  {
   "term": "Apair",
   "match": "apair",
   "gloss": "weaken",
   "kind": "archaic"
  },
  {
   "term": "Apparelled",
   "match": "apparelled",
   "gloss": "fitted up",
   "kind": "archaic"
  },
  {
   "term": "Appeach",
   "match": "appeach",
   "gloss": "impeach",
   "kind": "archaic"
  },
  {
   "term": "Appealed",
   "match": "appealed",
   "gloss": "challenged, accused",
   "kind": "archaic"
  },
  {
   "term": "Appertices",
   "match": "appertices",
   "gloss": "displays",
   "kind": "archaic"
  },
  {
   "term": "Araged",
   "match": "araged",
   "gloss": "enraged; confused",
   "kind": "archaic"
  },
  {
   "term": "Arase",
   "match": "arase",
   "gloss": "obliterate",
   "kind": "archaic"
  },
  {
   "term": "Armyvestal",
   "match": "armyvestal",
   "gloss": "martial",
   "kind": "archaic"
  },
  {
   "term": "Array",
   "match": "array",
   "gloss": "plight, state of affairs",
   "kind": "false-friend"
  },
  {
   "term": "Arson",
   "match": "arson",
   "gloss": "saddle-bow",
   "kind": "archaic"
  },
  {
   "term": "Askance",
   "match": "askance",
   "gloss": "casually",
   "kind": "archaic"
  },
  {
   "term": "Assoiled",
   "match": "assoiled",
   "gloss": "absolved",
   "kind": "archaic"
  },
  {
   "term": "Assotted",
   "match": "assotted",
   "gloss": "infatuated",
   "kind": "archaic"
  },
  {
   "term": "Assummon",
   "match": "assummon",
   "gloss": "summon",
   "kind": "archaic"
  },
  {
   "term": "Astonied",
   "match": "astonied",
   "gloss": "amazed, stunned",
   "kind": "archaic"
  },
  {
   "term": "Attaint",
   "match": "attaint",
   "gloss": "overcome",
   "kind": "false-friend"
  },
  {
   "term": "Aumbries",
   "match": "aumbries",
   "gloss": "chests",
   "kind": "archaic"
  },
  {
   "term": "Avail (at)",
   "match": "avail",
   "gloss": "at an advantage",
   "kind": "false-friend"
  },
  {
   "term": "Avaled",
   "match": "avaled",
   "gloss": "lowered",
   "kind": "archaic"
  },
  {
   "term": "Avaunt",
   "match": "avaunt",
   "gloss": "boast",
   "kind": "archaic"
  },
  {
   "term": "Aventred",
   "match": "aventred",
   "gloss": "couched",
   "kind": "archaic"
  },
  {
   "term": "Avised",
   "match": "avised",
   "gloss": "be advised, take thought",
   "kind": "archaic"
  },
  {
   "term": "Avision",
   "match": "avision",
   "gloss": "vision",
   "kind": "archaic"
  },
  {
   "term": "Avoid",
   "match": "avoid",
   "gloss": "quit",
   "kind": "false-friend"
  },
  {
   "term": "Avoided",
   "match": "avoided",
   "gloss": "got clear off",
   "kind": "archaic"
  },
  {
   "term": "Avow",
   "match": "avow",
   "gloss": "vow",
   "kind": "false-friend"
  },
  {
   "term": "Await of (in)",
   "match": "await of",
   "gloss": "in watch for",
   "kind": "false-friend"
  },
  {
   "term": "Awayward",
   "match": "awayward",
   "gloss": "away",
   "kind": "archaic"
  },
  {
   "term": "Awke",
   "match": "awke",
   "gloss": "sideways",
   "kind": "archaic"
  },
  {
   "term": "Bachelors",
   "match": "bachelors",
   "gloss": "probationers for knighthood",
   "kind": "archaic"
  },
  {
   "term": "Bain",
   "match": "bain",
   "gloss": "bath",
   "kind": "false-friend"
  },
  {
   "term": "Barbican",
   "match": "barbican",
   "gloss": "gate-tower",
   "kind": "archaic"
  },
  {
   "term": "Barget",
   "match": "barget",
   "gloss": "little ship",
   "kind": "archaic"
  },
  {
   "term": "Battle",
   "match": "battle",
   "gloss": "division of an army",
   "kind": "false-friend"
  },
  {
   "term": "Bawdy",
   "match": "bawdy",
   "gloss": "dirty",
   "kind": "false-friend"
  },
  {
   "term": "Be-closed",
   "match": "be-closed",
   "gloss": "enclosed",
   "kind": "archaic"
  },
  {
   "term": "Beams",
   "match": "beams",
   "gloss": "trumpets",
   "kind": "archaic"
  },
  {
   "term": "Bedashed",
   "match": "bedashed",
   "gloss": "splashed",
   "kind": "archaic"
  },
  {
   "term": "Behight",
   "match": "behight",
   "gloss": "promised",
   "kind": "archaic"
  },
  {
   "term": "Beholden (beholding) to",
   "match": "beholdento",
   "gloss": "obliged to",
   "kind": "archaic"
  },
  {
   "term": "Behote",
   "match": "behote",
   "gloss": "promised",
   "kind": "archaic"
  },
  {
   "term": "Benome",
   "match": "benome",
   "gloss": "deprived, taken away",
   "kind": "archaic"
  },
  {
   "term": "Besants",
   "match": "besants",
   "gloss": "gold coins",
   "kind": "archaic"
  },
  {
   "term": "Beseek",
   "match": "beseek",
   "gloss": "beseech",
   "kind": "archaic"
  },
  {
   "term": "Beseen",
   "match": "beseen",
   "gloss": "appointed, arrayed",
   "kind": "archaic"
  },
  {
   "term": "Beskift",
   "match": "beskift",
   "gloss": "shove off",
   "kind": "archaic"
  },
  {
   "term": "Bested",
   "match": "bested",
   "gloss": "beset",
   "kind": "archaic"
  },
  {
   "term": "Betaken",
   "match": "betaken",
   "gloss": "entrusted",
   "kind": "archaic"
  },
  {
   "term": "Betaught",
   "match": "betaught",
   "gloss": "entrusted, recommended",
   "kind": "archaic"
  },
  {
   "term": "Betid",
   "match": "betid",
   "gloss": "happened",
   "kind": "archaic"
  },
  {
   "term": "Betook",
   "match": "betook",
   "gloss": "committed, entrusted",
   "kind": "archaic"
  },
  {
   "term": "Bevered",
   "match": "bevered",
   "gloss": "quivered",
   "kind": "archaic"
  },
  {
   "term": "Board",
   "match": "board",
   "gloss": "sb., deck",
   "kind": "false-friend"
  },
  {
   "term": "Bobaunce",
   "match": "bobaunce",
   "gloss": "boasting, pride",
   "kind": "archaic"
  },
  {
   "term": "Boishe",
   "match": "boishe",
   "gloss": "bush, branch of a tree",
   "kind": "archaic"
  },
  {
   "term": "Boistous",
   "match": "boistous",
   "gloss": "rough",
   "kind": "archaic"
  },
  {
   "term": "Bole",
   "match": "bole",
   "gloss": "trunk of a tree",
   "kind": "archaic"
  },
  {
   "term": "Boot",
   "match": "boot",
   "gloss": "remedy",
   "kind": "false-friend"
  },
  {
   "term": "Borrow out",
   "match": "borrow out",
   "gloss": "redeem",
   "kind": "archaic"
  },
  {
   "term": "Borrows",
   "match": "borrows",
   "gloss": "pledges",
   "kind": "archaic"
  },
  {
   "term": "Bote",
   "match": "bote",
   "gloss": "remedy",
   "kind": "archaic"
  },
  {
   "term": "Bound",
   "match": "bound",
   "gloss": "ready",
   "kind": "false-friend"
  },
  {
   "term": "Bourded",
   "match": "bourded",
   "gloss": "jested",
   "kind": "archaic"
  },
  {
   "term": "Bourder",
   "match": "bourder",
   "gloss": "jester",
   "kind": "archaic"
  },
  {
   "term": "Braced",
   "match": "braced",
   "gloss": "embraced",
   "kind": "false-friend"
  },
  {
   "term": "Brachet",
   "match": "brachet",
   "gloss": "little hound",
   "kind": "archaic"
  },
  {
   "term": "Braide",
   "match": "braide",
   "gloss": "quick movement",
   "kind": "archaic"
  },
  {
   "term": "Brast",
   "match": "brast",
   "gloss": "burst, break",
   "kind": "archaic"
  },
  {
   "term": "Breaths",
   "match": "breaths",
   "gloss": "breathing holes",
   "kind": "archaic"
  },
  {
   "term": "Brief",
   "match": "brief",
   "gloss": "shorten",
   "kind": "archaic"
  },
  {
   "term": "Brim",
   "match": "brim",